{
  "schema_version": 2,
  "purpose": "reference_only",
  "sources": [
    {
      "id": "micro-definitions",
      "kind": "source_code",
      "title": "Micro shared range and clock definitions",
      "publisher": "Nuand",
      "revision": "2025.10 / libbladeRF 2.6.0",
      "url": "https://github.com/Nuand/bladeRF/blob/fcf9423325ae49f5fdd2e5b52ab68bfc2576ad47/fpga_common/include/bladerf2_common.h",
      "sha256": "76335006316c5a089b0e92bee3fedcce1156b13754368f2405ff7ff5b6d386a5",
      "commit": "fcf9423325ae49f5fdd2e5b52ab68bfc2576ad47"
    },
    {
      "id": "native-header",
      "kind": "source_code",
      "title": "libbladeRF sample representation and API contracts",
      "publisher": "Nuand",
      "revision": "2025.10 / libbladeRF 2.6.0",
      "url": "https://github.com/Nuand/bladeRF/blob/fcf9423325ae49f5fdd2e5b52ab68bfc2576ad47/host/libraries/libbladeRF/include/libbladeRF.h",
      "sha256": "49fff9b9c40a4e8f0341448e0a9ecc20d579ab598a6ba0241eac22fa28c9bf65",
      "commit": "fcf9423325ae49f5fdd2e5b52ab68bfc2576ad47"
    },
    {
      "id": "micro-driver",
      "kind": "source_code",
      "title": "Micro board and clock-control implementation",
      "publisher": "Nuand",
      "revision": "2025.10 / libbladeRF 2.6.0",
      "url": "https://github.com/Nuand/bladeRF/blob/fcf9423325ae49f5fdd2e5b52ab68bfc2576ad47/host/libraries/libbladeRF/src/board/bladerf2/bladerf2.c",
      "sha256": "ed134467d063f9108459d30b64ed590ebd5f44a314a449e2440d4cd36e0838f6",
      "commit": "fcf9423325ae49f5fdd2e5b52ab68bfc2576ad47"
    },
    {
      "id": "micro-api",
      "kind": "source_code",
      "title": "Micro-specific public API contracts",
      "publisher": "Nuand",
      "revision": "2025.10 / libbladeRF 2.6.0",
      "url": "https://github.com/Nuand/bladeRF/blob/fcf9423325ae49f5fdd2e5b52ab68bfc2576ad47/host/libraries/libbladeRF/include/bladeRF2.h",
      "sha256": "ab8862aad3aa7aa9fcbabfdd9002d3fe72ba70ba74e2474557c313a6afcc6abb",
      "commit": "fcf9423325ae49f5fdd2e5b52ab68bfc2576ad47"
    },
    {
      "id": "rfic-host",
      "kind": "source_code",
      "title": "AD9361 host-control implementation",
      "publisher": "Nuand",
      "revision": "2025.10 / libbladeRF 2.6.0",
      "url": "https://github.com/Nuand/bladeRF/blob/fcf9423325ae49f5fdd2e5b52ab68bfc2576ad47/host/libraries/libbladeRF/src/board/bladerf2/rfic_host.c",
      "sha256": "50b9cfb2cde62b358bc167a2c3ba608b57dd05c024f82c9cc79abcdefcdabd2b",
      "commit": "fcf9423325ae49f5fdd2e5b52ab68bfc2576ad47"
    },
    {
      "id": "schematic-14",
      "kind": "pdf",
      "title": "bladeRF 2.0 micro schematics REV 1.4",
      "publisher": "Nuand",
      "revision": "REV 1.4",
      "url": "https://www.nuand.com/bladeRF-2.0-micro-REV1.4.pdf",
      "sha256": "9873badac468f9bc2b501c2b1ed633af64405a50246d572716d6bc408fb2ce3d",
      "page_count": 17
    },
    {
      "id": "schematic-16",
      "kind": "pdf",
      "title": "bladeRF 2.0 micro schematics REV 1.6",
      "publisher": "Nuand",
      "revision": "REV 1.6",
      "url": "https://www.nuand.com/bladeRF-2.0-micro-REV1.6.pdf",
      "sha256": "c790c4859a12df55b997bffe8057b85078c543ed133bedc3ac36eb6a8cbb9d07",
      "page_count": 17
    },
    {
      "id": "nuand-faq",
      "kind": "web_page",
      "title": "Nuand bladeRF FAQ",
      "publisher": "Nuand",
      "revision": "Unversioned web page",
      "url": "https://www.nuand.com/frequently-asked-questions/",
      "sha256": "6fd4b8823a2c4b2cbcf93f02ec16a8f87b81f704dce5417d26a8868b25d572ab"
    },
    {
      "id": "nuand-micro-brief",
      "kind": "web_page",
      "title": "Nuand micro product description",
      "publisher": "Nuand",
      "revision": "Unversioned web page",
      "url": "https://www.nuand.com/bladerf-2-0-micro/",
      "sha256": "d3296b29c11af33ec6080fb411ee03769e1224fff67d943de8914eea28399cd6"
    },
    {
      "id": "sync-tutorial",
      "kind": "source_code",
      "title": "Synchronous streaming tutorial",
      "publisher": "Nuand",
      "revision": "2025.10 / libbladeRF 2.6.0",
      "url": "https://github.com/Nuand/bladeRF/blob/fcf9423325ae49f5fdd2e5b52ab68bfc2576ad47/host/libraries/libbladeRF/doc/doxygen/sync_no_meta.dox",
      "sha256": "bbf4e30c2aa2dcf347993101b5d20121c39e2fd47d2769a8cf5d9923600e4d89",
      "commit": "fcf9423325ae49f5fdd2e5b52ab68bfc2576ad47"
    },
    {
      "id": "sync-implementation",
      "kind": "source_code",
      "title": "Synchronous streaming buffer implementation",
      "publisher": "Nuand",
      "revision": "2025.10 / libbladeRF 2.6.0",
      "url": "https://github.com/Nuand/bladeRF/blob/fcf9423325ae49f5fdd2e5b52ab68bfc2576ad47/host/libraries/libbladeRF/src/streaming/sync.c",
      "sha256": "7fdfa93cd7d999c5a7907f1b6926834ba442429bd1faa465eefa65a743a550ba",
      "commit": "fcf9423325ae49f5fdd2e5b52ab68bfc2576ad47"
    }
  ],
  "claims": [
    {
      "id": "micro.rf.rx.tuning-range",
      "title": "Receive tuning range",
      "statement": "The pinned implementation gives RX a different lower tuning limit from TX.",
      "property": "rf.rx.tuning_range",
      "value": {
        "kind": "integer_range",
        "minimum": 70000000,
        "maximum": 6000000000,
        "unit": "Hz"
      },
      "scope": {
        "board_family": "bladeRF 2.0 micro",
        "fpga_variants": [
          "xA9"
        ],
        "pcb_revisions": [],
        "software": {
          "libbladeRF": "2.6.0"
        },
        "mode": "not_asserted"
      },
      "conditions": [
        "This is the range declared by the pinned micro implementation, not a guarantee of RF performance or sustained host throughput."
      ],
      "evidence_kind": "pinned_implementation",
      "evidence": [
        {
          "source_id": "micro-definitions",
          "locator": {
            "kind": "symbol",
            "symbol": "bladerf2_rx_frequency_range",
            "fragment": "L549-L555"
          }
        }
      ],
      "review": {
        "status": "source_checked",
        "method": "agent_assisted"
      }
    },
    {
      "id": "micro.rf.tx.tuning-range",
      "title": "Transmit tuning range",
      "statement": "The pinned implementation defines the transmit tuning range independently from receive.",
      "property": "rf.tx.tuning_range",
      "value": {
        "kind": "integer_range",
        "minimum": 47000000,
        "maximum": 6000000000,
        "unit": "Hz"
      },
      "scope": {
        "board_family": "bladeRF 2.0 micro",
        "fpga_variants": [
          "xA9"
        ],
        "pcb_revisions": [],
        "software": {
          "libbladeRF": "2.6.0"
        },
        "mode": "not_asserted"
      },
      "conditions": [
        "This is the range declared by the pinned micro implementation, not a guarantee of RF performance or sustained host throughput."
      ],
      "evidence_kind": "pinned_implementation",
      "evidence": [
        {
          "source_id": "micro-definitions",
          "locator": {
            "kind": "symbol",
            "symbol": "bladerf2_tx_frequency_range",
            "fragment": "L556-L563"
          }
        }
      ],
      "review": {
        "status": "source_checked",
        "method": "agent_assisted"
      }
    },
    {
      "id": "micro.sample-rate.base",
      "title": "Base-mode sample-rate range",
      "statement": "The normal feature mode selects the base sample-rate range.",
      "property": "sample_rate.range",
      "value": {
        "kind": "integer_range",
        "minimum": 520834,
        "maximum": 61440000,
        "unit": "samples/s"
      },
      "scope": {
        "board_family": "bladeRF 2.0 micro",
        "fpga_variants": [
          "xA9"
        ],
        "pcb_revisions": [],
        "software": {
          "libbladeRF": "2.6.0"
        },
        "mode": "base"
      },
      "conditions": [
        "This is the range declared by the pinned micro implementation, not a guarantee of RF performance or sustained host throughput.",
        "Low rates can require RFIC interpolation/decimation filters; use actual readbacks."
      ],
      "evidence_kind": "pinned_implementation",
      "evidence": [
        {
          "source_id": "micro-definitions",
          "locator": {
            "kind": "symbol",
            "symbol": "bladerf2_sample_rate_range_base",
            "fragment": "L517-L524"
          }
        },
        {
          "source_id": "micro-driver",
          "locator": {
            "kind": "symbol",
            "symbol": "bladerf2_get_sample_rate_range",
            "fragment": "L979-L992"
          }
        }
      ],
      "review": {
        "status": "source_checked",
        "method": "agent_assisted"
      }
    },
    {
      "id": "micro.sample-rate.oversample",
      "title": "Extended-mode sample-rate range",
      "statement": "The oversample feature selects a different rate range.",
      "property": "sample_rate.range",
      "value": {
        "kind": "integer_range",
        "minimum": 6250000,
        "maximum": 122880000,
        "unit": "samples/s"
      },
      "scope": {
        "board_family": "bladeRF 2.0 micro",
        "fpga_variants": [
          "xA9"
        ],
        "pcb_revisions": [],
        "software": {
          "libbladeRF": "2.6.0"
        },
        "mode": "oversample"
      },
      "conditions": [
        "This is the range declared by the pinned micro implementation, not a guarantee of RF performance or sustained host throughput.",
        "Requires the oversample feature and compatible gateware/format configuration; this is not the ordinary mode or a sustained-streaming measurement."
      ],
      "evidence_kind": "pinned_implementation",
      "evidence": [
        {
          "source_id": "micro-definitions",
          "locator": {
            "kind": "symbol",
            "symbol": "bladerf2_sample_rate_range_oversample",
            "fragment": "L525-L532"
          }
        },
        {